{
  "name": "Light",
  "colors": {
    "primary": {
      "space": "RGB",
      "components": [
        0.09803922,
        0.4627451,
        0.8235294,
        1.0
      ]
    },
    "secondary": {
      "space": "RGB",
      "components": [
        0.25882354,
        0.25882354,
        0.25882354,
        1.0
      ]
    },
    "background": {
      "space": "RGB",
      "components": [
        1.0,
        1.0,
        1.0,
        1.0
      ]
    },
    "surface": {
      "space": "RGB",
      "components": [
        0.9607843,
        0.9607843,
        0.9607843,
        1.0
      ]
    },
    "error": {
      "space": "RGB",
      "components": [
        0.827451,
        0.18431373,
        0.18431373,
        1.0
      ]
    },
    "warning": {
      "space": "RGB",
      "components": [
        1.0,
        0.627451,
        0.0,
        1.0
      ]
    },
    "success": {
      "space": "RGB",
      "components": [
        0.21960784,
        0.5568628,
        0.23529412,
        1.0
      ]
    },
    "info": {
      "space": "RGB",
      "components": [
        0.007843138,
        0.53333336,
        0.81960785,
        1.0
      ]
    },
    "text_primary": {
      "space": "RGB",
      "components": [
        0.12941177,
        0.12941177,
        0.12941177,
        1.0
      ]
    },
    "text_secondary": {
      "space": "RGB",
      "components": [
        0.45882353,
        0.45882353,
        0.45882353,
        1.0
      ]
    },
    "text_disabled": {
      "space": "RGB",
      "components": [
        0.7411765,
        0.7411765,
        0.7411765,
        1.0
      ]
    },
    "custom": {}
  },
  "typography": {
    "font_family": "system-ui, -apple-system, sans-serif",
    "font_size_base": 16.0,
    "font_size_small": 14.0,
    "font_size_large": 20.0,
    "line_height": 1.5
  },
  "spacing": {
    "unit": 8.0,
    "small": 8.0,
    "medium": 16.0,
    "large": 24.0
  },
  "borders": {
    "width": 1.0,
    "radius": 4.0,
    "color": {
      "space": "RGB",
      "components": [
        0.8784314,
        0.8784314,
        0.8784314,
        1.0
      ]
    }
  },
  "shadows": {
    "enabled": true,
    "blur_radius": 4.0,
    "offset_x": 0.0,
    "offset_y": 2.0,
    "color": {
      "space": "RGB",
      "components": [
        0.0,
        0.0,
        0.0,
        0.2
      ]
    }
  }
}